rank,company,score_100,priority,segment,website,areas,portfolio_size,portfolio_confidence,business_type,premium_scale_signal,ops_complexity_signals,main_pain_hypothesis,best_pitch_angle,decision_maker,best_channel,email,whatsapp_phone,instagram_social,contactability,status,next_action,notes
29,"STAY Bali",74.4,B+,"Wave 2","https://stay-bali.com/","Seminyak; Canggu","20 luxury villas",High,"Property management division; luxury villa management","20 luxury villas; 70-80% occupancy; 350+ Airbnb reviews; technology/transparency/professionalism","Guest services; staff hiring/training; monthly financial reports; owner reporting; housekeeping/staff coordination","Lean premium team balancing guest inquiries, staff coordination, housekeeping and owner updates","Response consistency + owner visibility for smaller premium operator: answer like a bigger team without hiring more reservations staff","Owner/GM/Ops lead unknown","Email-first after contact verification","info@stay-bali.com","+628 533 378 54 88",Unknown,Medium,"Needs stakeholder verification","Find decision-maker or confirm active channel; then send boutique ROI angle","Good premium candidate, but smaller and less visible stakeholder map"
30,"Great Bali Villas",73.1,C+,"Wave 2 / Needs verification / Strategic","https://www.greatbalivillas.com/","Bali + Lombok; Seminyak; Canggu; Jimbaran; Uluwatu; Nusa Dua","327+ listed villas",Medium,"Villa rental / managed villa collection","327+ handpicked villas; concierge; WhatsApp booking","WhatsApp-first booking; replies in hours; concierge; airport transfers; high inquiry volume","Speed-to-lead and pre-arrival upsell follow-up across WhatsApp-heavy booking flow","WhatsApp response layer and pre-arrival upsell/follow-up workflow",Unknown,"WhatsApp / website","info@greatbalivillas.com","+62 821 4647 5705","https://instagram.com/greatbalivillas.official",Medium,"Needs verification","Verify managed inventory vs curated/listed inventory before outreach","Listed inventory may not equal managed portfolio"
31,"Bali Luxury Villas",72.9,B-,"Wave 2 / Needs verification","https://www.baliluxuryvillas.com/page/villa-management","Various Bali luxury markets","16+ example villas shown; total unknown",Low,"Luxury villa rentals + villa management","Since 1999; luxury-only positioning; 5-star standards","Reservations; guest relations; staffing; owner confidence; high-end service consistency","Manual guest follow-up and service consistency across luxury reservations and villa operations","Approved-response workflow that preserves 5-star tone and reduces manual guest follow-up",Unknown,"Website / contact form",Unknown,Unknown,Unknown,Medium,"Needs verification","Verify managed portfolio size and best contact path","Strong luxury positioning, but managed-vs-listed stock unclear"
32,"Betterplace",67.0,B,"Strategic / Later","https://betterplace.cc/","Bali broader; Canggu; Umalas; Seminyak; Uluwatu; Ubud; Tabanan; Nusa Dua; Sanur","1000+ listings; managed share unclear","Low/Medium","Real estate / rental / property management platform","Upscale/luxury homes; investor dashboard; guest concierge; legal/notary; integrated acquisition + management","Investor + rental flow; owner acquisition; guest concierge; direct inquiries","Need pilot scope; too broad for standard fixed-scope install","Contained pilot focused on reservation response governance, not full-stack replacement",Unknown,"Website / form / email","hello@betterplace.cc","+62 813 7773 2003","https://www.instagram.com/betterplace.cc/ ; LinkedIn company page",Medium,"Strategic / later","Only approach with specific pilot scope","Larger-than-ideal; strategic but not first-wave"
33,"Balid Villa Management",66.7,"B-/C+","Wave 2 / Needs verification / Research hold","https://balidvillamanagement.com/","Southern Bali; Uluwatu; Jimbaran; Pecatu","Unknown; 1500+ bookings and 2257+ nights managed confirmed, but active managed portfolio count not public",Low,"Villa management and marketing service in Southern Bali","Luxury villas; Uluwatu/Jimbaran/Pecatu positioning; 1500+ bookings; 2257+ nights managed; villa operations + marketing focus","Concierge service; 24/7 guest communications; daily operations; social media marketing; content creation; OTA distribution; tax reporting; financial reporting","Response consistency across OTA, WhatsApp/social inquiries, guest communications, reporting and daily villa operations","Faster first response and approved answers across OTA, website/social inquiries and guest communications",Unknown,"Website / Instagram / Facebook",Unknown,"Not confirmed","https://www.instagram.com/balid.villa.management/ ; Facebook page surfaced","Low/Medium","Needs verification / research hold","Do not prioritize; verify direct WhatsApp/email and decision-maker first","Brand and operating model confirmed, but buying path remains weak"
34,"Bukit Vista",66.6,C,"Benchmark / Later","https://www.bukitvista.com/bali-villa-management","Bali overall",Unknown,Low,"Short-term rental / property management","Top partner language; full-service management; smart tools","Booking flow; owner acquisition; property launch; likely already tech-heavy","Owner acquisition and guest inquiry pipeline may benefit from faster qualification, but company may already be tool-mature","Fast-response + qualification layer for owner acquisition and guest inquiry pipeline",Unknown,"Website / LinkedIn",Unknown,Unknown,Unknown,Medium,"Later benchmark","Do not prioritize early; use as benchmark or later approach","Relevant but likely already process/tool mature"
